debug_data.json

{
  "Short-term": {
    "CMG": {
      "Hierarchical": [
        "1.75",
        "2.21",
        "4.39"
      ],
      "Round Robin": [
        "3.01",
        "3.16",
        "7.59"
      ],
      "Ensemble": [
        "0.95",
        "1.36",
        "2.51"
      ]
    },
    "DGC": {
      "Hierarchical": [
        "2.77",
        "3.33",
        "2.94"
      ],
      "Round Robin": [
        "3.80",
        "4.34",
        "4.04"
      ],
      "Ensemble": [
        "2.22",
        "2.84",
        "2.31"
      ]
    },
    "DXG": {
      "Hierarchical": [
        "0.71",
        "0.94",
        "3.08"
      ],
      "Round Robin": [
        "0.79",
        "0.97",
        "3.49"
      ],
      "Ensemble": [
        "0.89",
        "1.09",
        "3.89"
      ]
    },
    "FPT": {
      "Hierarchical": [
        "2.67",
        "2.85",
        "2.78"
      ],
      "Round Robin": [
        "2.16",
        "2.50",
        "2.27"
      ],
      "Ensemble": [
        "1.38",
        "1.58",
        "1.40"
      ]
    },
    "HPG": {
      "Hierarchical": [
        "1.25",
        "1.31",
        "4.52"
      ],
      "Round Robin": [
        "1.11",
        "1.25",
        "4.01"
      ],
      "Ensemble": [
        "3.78",
        "3.92",
        "13.71"
      ]
    },
    "KDH": {
      "Hierarchical": [
        "4.38",
        "4.59",
        "12.74"
      ],
      "Round Robin": [
        "1.60",
        "2.33",
        "4.46"
      ],
      "Ensemble": [
        "1.74",
        "1.81",
        "5.00"
      ]
    },
    "MBB": {
      "Hierarchical": [
        "0.75",
        "0.89",
        "2.85"
      ],
      "Round Robin": [
        "0.55",
        "0.72",
        "2.21"
      ],
      "Ensemble": [
        "0.66",
        "0.81",
        "2.50"
      ]
    },
    "MWG": {
      "Hierarchical": [
        "2.59",
        "2.95",
        "3.17"
      ],
      "Round Robin": [
        "2.68",
        "3.45",
        "3.32"
      ],
      "Ensemble": [
        "3.93",
        "4.94",
        "4.62"
      ]
    },
    "TCB": {
      "Hierarchical": [
        "1.52",
        "1.76",
        "4.08"
      ],
      "Round Robin": [
        "1.42",
        "1.54",
        "3.67"
      ],
      "Ensemble": [
        "2.35",
        "2.69",
        "6.03"
      ]
    },
    "VCB": {
      "Hierarchical": [
        "1.34",
        "1.55",
        "2.22"
      ],
      "Round Robin": [
        "1.09",
        "1.32",
        "1.81"
      ],
      "Ensemble": [
        "1.79",
        "1.96",
        "2.93"
      ]
    },
    "VCS": {
      "Hierarchical": [
        "0.75",
        "0.82",
        "1.59"
      ],
      "Round Robin": [
        "0.72",
        "0.81",
        "1.55"
      ],
      "Ensemble": [
        "0.68",
        "0.80",
        "1.45"
      ]
    },
    "VHM": {
      "Hierarchical": [
        "3.05",
        "4.63",
        "2.72"
      ],
      "Round Robin": [
        "3.33",
        "3.95",
        "2.96"
      ],
      "Ensemble": [
        "3.19",
        "3.25",
        "2.85"
      ]
    }
  },
  "Medium-term": {
    "CMG": {
      "Hierarchical": [
        "4.08",
        "4.59",
        "10.09"
      ],
      "Round Robin": [
        "3.01",
        "3.41",
        "7.40"
      ],
      "Ensemble": [
        "1.54",
        "1.63",
        "3.81"
      ]
    },
    "DGC": {
      "Hierarchical": [
        "5.09",
        "5.82",
        "5.31"
      ],
      "Round Robin": [
        "1.68",
        "2.05",
        "1.78"
      ],
      "Ensemble": [
        "0.59",
        "0.79",
        "0.60"
      ]
    },
    "DXG": {
      "Hierarchical": [
        "2.99",
        "4.53",
        "14.60"
      ],
      "Round Robin": [
        "1.84",
        "2.16",
        "8.67"
      ],
      "Ensemble": [
        "2.06",
        "3.19",
        "9.99"
      ]
    },
    "FPT": {
      "Hierarchical": [
        "7.09",
        "8.12",
        "6.91"
      ],
      "Round Robin": [
        "7.63",
        "8.10",
        "7.46"
      ],
      "Ensemble": [
        "5.81",
        "6.97",
        "5.66"
      ]
    },
    "HPG": {
      "Hierarchical": [
        "1.40",
        "1.63",
        "4.98"
      ],
      "Round Robin": [
        "1.19",
        "1.36",
        "4.29"
      ],
      "Ensemble": [
        "3.19",
        "3.54",
        "11.43"
      ]
    },
    "KDH": {
      "Hierarchical": [
        "5.40",
        "6.10",
        "15.29"
      ],
      "Round Robin": [
        "1.61",
        "1.99",
        "4.54"
      ],
      "Ensemble": [
        "1.38",
        "1.41",
        "3.89"
      ]
    },
    "MBB": {
      "Hierarchical": [
        "1.73",
        "1.92",
        "6.92"
      ],
      "Round Robin": [
        "1.37",
        "1.64",
        "5.58"
      ],
      "Ensemble": [
        "0.70",
        "0.79",
        "2.77"
      ]
    },
    "MWG": {
      "Hierarchical": [
        "4.39",
        "4.53",
        "5.41"
      ],
      "Round Robin": [
        "4.03",
        "4.98",
        "4.95"
      ],
      "Ensemble": [
        "1.93",
        "2.22",
        "2.39"
      ]
    },
    "TCB": {
      "Hierarchical": [
        "3.90",
        "4.41",
        "11.08"
      ],
      "Round Robin": [
        "1.68",
        "2.36",
        "4.83"
      ],
      "Ensemble": [
        "1.88",
        "2.31",
        "5.07"
      ]
    },
    "VCB": {
      "Hierarchical": [
        "2.56",
        "2.68",
        "4.15"
      ],
      "Round Robin": [
        "2.49",
        "2.64",
        "4.01"
      ],
      "Ensemble": [
        "2.51",
        "2.71",
        "4.04"
      ]
    },
    "VCS": {
      "Hierarchical": [
        "0.74",
        "1.19",
        "1.55"
      ],
      "Round Robin": [
        "1.38",
        "1.98",
        "2.82"
      ],
      "Ensemble": [
        "0.75",
        "0.94",
        "1.57"
      ]
    },
    "VHM": {
      "Hierarchical": [
        "8.52",
        "9.52",
        "8.37"
      ],
      "Round Robin": [
        "3.66",
        "4.15",
        "3.63"
      ],
      "Ensemble": [
        "3.41",
        "4.47",
        "3.33"
      ]
    }
  },
  "Long-term": {
    "CMG": {
      "Hierarchical": [
        "4.38",
        "5.11",
        "11.45"
      ],
      "Round Robin": [
        "3.40",
        "3.59",
        "9.09"
      ],
      "Ensemble": [
        "2.40",
        "2.95",
        "6.71"
      ]
    },
    "DGC": {
      "Hierarchical": [
        "3.85",
        "4.83",
        "5.30"
      ],
      "Round Robin": [
        "4.39",
        "5.72",
        "6.12"
      ],
      "Ensemble": [
        "2.77",
        "3.81",
        "3.83"
      ]
    },
    "DXG": {
      "Hierarchical": [
        "3.60",
        "4.55",
        "21.17"
      ],
      "Round Robin": [
        "4.73",
        "5.42",
        "27.04"
      ],
      "Ensemble": [
        "3.25",
        "4.06",
        "19.10"
      ]
    },
    "FPT": {
      "Hierarchical": [
        "5.50",
        "7.82",
        "5.82"
      ],
      "Round Robin": [
        "5.52",
        "7.88",
        "5.87"
      ],
      "Ensemble": [
        "4.36",
        "6.03",
        "4.61"
      ]
    },
    "HPG": {
      "Hierarchical": [
        "1.13",
        "1.16",
        "4.23"
      ],
      "Round Robin": [
        "0.85",
        "0.94",
        "3.19"
      ],
      "Ensemble": [
        "2.51",
        "3.09",
        "9.41"
      ]
    },
    "KDH": {
      "Hierarchical": [
        "3.48",
        "3.84",
        "10.65"
      ],
      "Round Robin": [
        "1.48",
        "1.90",
        "4.50"
      ],
      "Ensemble": [
        "1.93",
        "2.51",
        "5.91"
      ]
    },
    "MBB": {
      "Hierarchical": [
        "1.65",
        "1.95",
        "6.87"
      ],
      "Round Robin": [
        "1.45",
        "1.59",
        "6.02"
      ],
      "Ensemble": [
        "0.50",
        "0.60",
        "2.10"
      ]
    },
    "MWG": {
      "Hierarchical": [
        "3.45",
        "3.61",
        "4.24"
      ],
      "Round Robin": [
        "2.21",
        "3.02",
        "2.68"
      ],
      "Ensemble": [
        "2.18",
        "3.27",
        "2.65"
      ]
    },
    "TCB": {
      "Hierarchical": [
        "5.49",
        "5.92",
        "16.52"
      ],
      "Round Robin": [
        "2.29",
        "2.77",
        "6.92"
      ],
      "Ensemble": [
        "2.24",
        "3.14",
        "6.87"
      ]
    },
    "VCB": {
      "Hierarchical": [
        "5.21",
        "5.81",
        "8.94"
      ],
      "Round Robin": [
        "8.83",
        "10.10",
        "15.01"
      ],
      "Ensemble": [
        "5.66",
        "5.74",
        "9.71"
      ]
    },
    "VCS": {
      "Hierarchical": [
        "4.12",
        "4.19",
        "9.24"
      ],
      "Round Robin": [
        "1.55",
        "1.74",
        "3.41"
      ],
      "Ensemble": [
        "3.79",
        "3.97",
        "8.48"
      ]
    },
    "VHM": {
      "Hierarchical": [
        "5.85",
        "6.99",
        "6.03"
      ],
      "Round Robin": [
        "5.76",
        "6.11",
        "5.86"
      ],
      "Ensemble": [
        "5.19",
        "5.83",
        "5.30"
      ]
    }
  }
}

table/test.md

\multirow{3}{*}{\textbf{FPT}}
& RoundRobin      & \textbf{2.79} & \textbf{3.27} & \textbf{2.8\%} \\
& Hierarchical    & 2.82 & 3.29 & 2.9\% \\
& Ensemble Voting & 2.90 & 3.38 & 2.9\% \\
\hline

\multirow{3}{*}{\textbf{VCS}}
& Hierarchical    & \textbf{1.73} & \textbf{1.79} & \textbf{3.7\%} \\
& RoundRobin      & 1.80 & 1.85 & 3.8\% \\
& Ensemble Voting & 2.26 & 2.40 & 4.8\% \\
\hline

\multirow{3}{*}{\textbf{VCB}}
& Hierarchical    & \textbf{1.16} & \textbf{1.58} & \textbf{1.8\%} \\
& Ensemble Voting & 1.63 & 2.01 & 2.6\% \\
& RoundRobin      & 1.67 & 2.23 & 2.7\% \\
\hline

\multirow{3}{*}{\textbf{VCS}}
& RoundRobin      & \textbf{2.22} & \textbf{2.27} & \textbf{4.6\%} \\
& Hierarchical    & 2.23 & 2.30 & 4.7\% \\
& Ensemble Voting & 2.30 & 2.37 & 4.8\% \\
\hline

\multirow{3}{*}{\textbf{FPT}}
& Ensemble Voting & \textbf{2.06} & \textbf{2.73} & \textbf{2.2\%} \\
& Hierarchical    & 3.12 & 3.61 & 3.3\% \\
& RoundRobin      & 3.70 & 5.88 & 3.9\% \\
\hline

\multirow{3}{*}{\textbf{VCS}}
& Ensemble Voting & \textbf{1.31} & \textbf{1.50} & \textbf{2.8\%} \\
& Hierarchical    & 1.76 & 1.81 & 3.8\% \\
& RoundRobin      & 1.79 & 1.85 & 3.8\% \\
\hline

\multirow{3}{*}{\textbf{VCS}}
& RoundRobin      & \textbf{1.65} & \textbf{1.95} & \textbf{3.4\%} \\
& Ensemble Voting & 1.85 & 2.05 & 3.8\% \\
& Hierarchical    & 2.20 & 2.26 & 4.6\% \\
\hline

\multirow{3}{*}{\textbf{DXG}}
& Hierarchical    & \textbf{3.83} & \textbf{4.29} & \textbf{21.8\%} \\
& Ensemble Voting & 3.86 & 4.29 & 22.1\% \\
& RoundRobin      & 4.19 & 4.63 & 23.9\% \\
\hline

\multirow{3}{*}{\textbf{FPT}}
& RoundRobin      & \textbf{1.48} & \textbf{1.99} & \textbf{1.6\%} \\
& Ensemble Voting & 2.11 & 2.68 & 2.2\% \\
& Hierarchical    & 2.24 & 2.86 & 2.4\% \\
\hline